{
  "mwer": "0.1",
  "id": null,
  "revision": 1,
  "created": "2026-09-15T00:00:00Z",
  "digest": null,
  "provenance": { "mode": "authored", "author": "MWER pilot draft" },
  "visible": {
    "family": "identity",
    "setting": {
      "path": ["history", "ancient-mediterranean"],
      "description": "Athens in 416 BCE, days before the Assembly decides what to do about an island that refused to join its empire.",
      "request": null
    },
    "role": "A young citizen asked to speak for the hard-line position in the Assembly.",
    "intensity": 3,
    "boundaries": { "sexual": "none", "violence": "implied", "language": "moderate", "exclude": [] }
  },
  "sealed": {
    "primary": "arch.dissonance",
    "secondary": ["arch.inhabitation"],
    "attractors": [
      "The participant becomes more persuasive on behalf of a position they reject."
    ],
    "invariants": [
      "The position is argued in its strongest form by intelligent people with real reasons.",
      "The participant's arguments have consequences for people who are not in the room."
    ],
    "secrets": []
  }
}
